id_comentario,id_cliente,id_producto,calificacion,texto_comentario,fecha_comentario,texto_preprocesado,sentimiento,score
1,1,2,5,"El Smartphone Nexus 5G es un cambio de juego. La pantalla OLED es vívida, la cámara de 108MP captura detalles impresionantes incluso en condiciones de baja luminosidad, y el procesador ultrarrápido hace que todo se sienta increíblemente fluido. La duración de la batería es asombrosa, superando fácilmente mis días más largos de uso intensivo con navegación, redes sociales y juegos. La carga rápida de 65W es un salvavidas cuando necesito un impulso rápido de energía.",2024-05-20,smartphonir nexus g cambio juego pantalla oled vívir cámara captura detalle impresionante condición bajo luminosidad procesador ultrarrápido sentar increíblemente fluido duración batería asombroso superar fácilmente largo intensivo navegación red social juego carga rápido salvavidas necesitar impulso rápido energía,5 stars,0.6362859606742859
2,2,4,4,"La Camiseta Deportiva Ultralight es muy cómoda para mis entrenamientos matutinos. El material es ligero y transpirable, se siente muy bien en la piel. Sin embargo, la talla L es un poco más ajustada de lo que esperaba en los hombros. Aún así, es un gran producto para el gimnasio y se seca rápidamente después de sudar, lo que evita esa sensación de humedad tan desagradable.",2024-05-21,camiseta deportivo ultralight cómodo entrenamiento matutino material ligero transpirable sentir piel talla l ajustado esperar hombro producto gimnasio secar rápidamente sudar evitar sensación humedad desagradable,4 stars,0.3437025845050812
3,3,1,5,"La Laptop Gamer Pro es una bestia de rendimiento. Ha superado todas mis expectativas en juegos y edición de video. Con el procesador Intel Core i9 y la RTX 4080, los tiempos de renderizado son casi inexistentes. El sistema de refrigeración es eficiente y el diseño es elegante, no parece una laptop gamer típica con luces exageradas. El teclado mecánico retroiluminado es un placer de usar para escribir y jugar. Realmente vale cada centavo.",2024-05-22,laptop gamer pro bestia rendimiento superar expectativa juego edición video procesador intel core rtx tiempo renderizado inexistente sistema refrigeración eficiente diseño elegante laptop gamer típico luz exagerada teclado mecánico retroiluminado placer escribir jugar realmente valer centavo,4 stars,0.26941731572151184
4,4,5,3,"Las Zapatillas Urbanas Fit tienen un diseño muy atractivo, pero me resultaron bastante rígidas en la primera semana de uso. La suela no se dobla bien al caminar. Espero que con el tiempo se adapten a la forma de mi pie, porque por ahora no son tan cómodas como esperaba para caminatas largas. La calidad del material parece decente, pero el confort es un problema.",2024-05-23,zapatilla urbano fit diseño atractivo resultar rígido semana suela doblar caminar esperar tiempo adaptar forma pie cómodo esperar caminata larga calidad material decente confort problema,3 stars,0.43352919816970825
5,5,3,4,"Los Auriculares Inalámbricos X ofrecen un sonido nítido y potente. La conexión Bluetooth es estable y no se interrumpe, lo cual es muy importante para mí. La única pega es que la cancelación de ruido no es tan efectiva en ambientes muy ruidosos, como el transporte público o una cafetería llena de gente. Aún así, para escuchar música en casa o en la oficina, son perfectos.",2024-05-24,auricular inalámbrico x ofrecer sonido nítido potente conexión bluetooth estable interrumpir importante único pega cancelación ruido efectivo ambiente ruidoso transporte público cafetería lleno gente escuchar música casa oficina perfecto,4 stars,0.4272591471672058
6,6,6,5,"'El Círculo Mágico' es una lectura absorbente y fascinante. La construcción del mundo es compleja y está llena de detalles que te sumergen por completo en la historia. Los personajes están muy bien desarrollados y sus motivaciones son creíbles. Una joya para los amantes de la fantasía épica, me dejó con ganas de más. La trama tiene giros muy inesperados que te mantienen al borde del asiento. Lo recomiendo encarecidamente.",2024-05-25,círculo mágico lectura absorbente fascinante construcción mundo complejo lleno detalle sumergen completo historia personaje desarrollado motivación creíble joya amante fantasía épico gana trama giro inesperado mantener borde asiento recomeir encarecidamente,5 stars,0.5599901676177979
7,7,7,5,"El Set de Ollas Premium es una inversión fantástica. Cocinar con ellas es un placer; el calor se distribuye de manera uniforme por toda la base, evitando que los alimentos se quemen en una sola área. La limpieza es sorprendentemente fácil, incluso los restos de comida más pegados se quitan sin esfuerzo. Se ven muy duraderas y el acabado de acero inoxidable es muy elegante en mi cocina.",2024-05-26,set olla premium inversión fantástico cocinar placer calor distribuir uniforme base evitar alimento quemar área limpieza sorprendentemente fácil resto comida pegado quitar esfuerzo ver duradero acabado acero inoxidable elegante cocina,5 stars,0.7454773783683777
8,8,8,5,"El Balón de Fútbol Pro tiene un agarre excepcional y un peso perfecto para driblar y disparar con precisión. La cubierta texturizada me permite tener un control total en el campo. Se siente muy robusto y de alta calidad, ideal para partidos intensos y entrenamientos. La cámara de aire retiene muy bien la presión, no he tenido que inflarlo en semanas. Es un balón de gran rendimiento.",2024-05-27,balón fútbol pro agarre excepcional peso perfecto driblar disparar precisión cubierta texturizada permitir control campo sentir robusto alto calidad ideal partido intenso entrenamiento cámara aire retener presión inflar él semana balón rendimiento,5 stars,0.7253119945526123
9,9,9,4,"La Mochila Urbana Tech es muy práctica. Me encanta el compartimento para el portátil y los múltiples bolsillos que me ayudan a mantener todo organizado. Sin embargo, el material me parece un poco delgado y no estoy seguro de que aguante mucho peso a largo plazo. El puerto USB es un detalle muy útil para cargar mi teléfono en movimiento, pero la calidad del material me deja con dudas.",2024-05-28,mochilo urbana tech práctico encantar compartimento portátil múltiple bolsillo ayudar mantener organizado material delgado seguro aguantar peso plazo puerto usb detalle útil cargar teléfono movimiento calidad material dejar duda,5 stars,0.4790897071361542
10,10,10,5,"La Cámara de Acción 4K es una maravilla para mis viajes. La calidad de video es increíble, incluso bajo el agua. Es muy fácil de usar gracias a su pantalla táctil y los menús son intuitivos. La carcasa protectora es muy resistente a los golpes y el agua. He grabado videos de buceo espectaculares sin ningún problema. La estabilización de imagen es fantástica para tomas en movimiento.",2024-05-29,cámara acción maravilla viaje calidad video increíble agua fácil gracias pantalla táctil menú intuitivo carcasa protectora resistente golpe agua grabar video buceo espectacular problema estabilización imagen fantástico toma movimiento,5 stars,0.664955735206604
11,11,1,4,"El rendimiento de la Laptop Gamer Pro es excepcional, pero la duración de la batería es un punto débil. Para tareas básicas dura un par de horas, pero para gaming tengo que mantenerla conectada la mayor parte del tiempo, lo cual limita un poco su portabilidad. Ideal para un escritorio, pero no para llevarla de un lado a otro.",2024-05-30,rendimiento laptop gamer pro excepcional duración batería punto débil tarea básico durar par hora gaming mantener él conectado tiempo limitar portabilidad ideal escritorio llevar él,4 stars,0.43240830302238464
12,12,2,3,"El Smartphone Nexus 5G es rápido, pero las fotos que toma en condiciones de poca luz son granuladas y pierden nitidez. Esperaba un mejor desempeño en fotografía nocturna. No es un teléfono para los amantes de la fotografía con poca luz.",2024-05-31,smartphonir nexus g rápido foto tomar condición luz granulado perder nitidez esperar desempeño fotografía nocturno teléfono amante fotografía luz,3 stars,0.3188510835170746
13,13,3,5,"El mejor par de auriculares que he tenido. La calidad de audio es espectacular, y la almohadilla es muy suave y cómoda, perfecta para largas sesiones de música o videollamadas. La cancelación de ruido funciona muy bien en entornos de oficina.",2024-06-01,par auricular calidad audio espectacular almohadilla suave cómodo perfecto larga sesión música videollamada cancelación ruido funcionar entorno oficina,5 stars,0.5743916630744934
14,14,4,5,"La camiseta es perfecta para todo. El material es suave, no irrita la piel y no se deforma al lavarse. Ya he comprado varias en diferentes colores. Es muy fresca y no retiene el sudor, lo cual es ideal para el calor.",2024-06-02,camiseta perfecto material suave irritar piel deformar lavar él comprar color fresco retener sudor ideal calor,5 stars,0.6062828302383423
15,15,5,2,"Estas zapatillas me decepcionaron. Se sintieron muy rígidas desde el primer momento y el soporte para el arco es inexistente. No las recomiendo para caminatas largas, me causaron dolor en los pies. La suela es muy dura y no amortigua bien.",2024-06-03,zapatilla decepcionar sentir rígido momento soporte arco inexistente recomeir caminata larga causar dolor pie suela duro amortiguar,1 star,0.5843271613121033
16,16,6,4,"Una historia muy interesante. La trama es original, pero el ritmo se sintió un poco lento en la mitad del libro. A pesar de eso, los personajes son entrañables y la prosa es muy descriptiva. Volvería a leer algo del autor. Es un buen libro para pasar el tiempo.",2024-06-04,historia interesante trama original ritmo sentir lento mitad libro personaje entrañabl prosa descriptivo volver leer autor libro pasar tiempo,3 stars,0.46233224868774414
17,17,7,5,"Estas ollas han transformado mi cocina. La base antiadherente funciona de maravilla y el calor se distribuye de forma tan uniforme que mis comidas quedan perfectas. Se lavan en segundos, lo cual es muy conveniente. Son una inversión que vale la pena para cualquier cocinero aficionado.",2024-06-05,olla transformar cocina base antiadherente funcionar maravilla calor distribuir forma uniforme comida quedar perfecto lavar segundo conveniente inversión valer pena cocinero aficionado,5 stars,0.613028883934021
18,18,8,4,"Buen balón, la costura es muy resistente y el material exterior parece duradero, pero el diseño estampado se empezó a desgastar a las pocas semanas de uso. Cumple su función en el campo, que es lo más importante. Se siente muy bien al tacto.",2024-06-06,balón costura resistente material exterior duradero diseño estampado empezar desgastar semana cumplir función campo importante sentir tacto,4 stars,0.3914853036403656
19,19,9,3,"La mochila es funcional para llevar mis cosas al trabajo, pero los cierres se sienten débiles y la tela es bastante delgada. No parece que vaya a durar mucho tiempo. El puerto USB es un buen detalle, pero la calidad general es regular, esperaba más por el precio.",2024-06-07,mochilo funcional cosa trabajo cierre sentir débil tela delgado durar tiempo puerto usb detalle calidad general regular esperar precio,3 stars,0.4115038216114044
20,20,10,4,"La cámara de acción tiene una gran calidad de imagen, pero la aplicación móvil para transferir videos es frustrantemente lenta y a veces se desconecta sin motivo. Por lo demás, la cámara en sí es muy robusta y fácil de usar. La calidad de video 4K es impresionante.",2024-06-08,cámara acción calidad imagen aplicación móvil transferir video frustrantemente lento desconectar motivo cámara robusta fácil calidad video impresionante,4 stars,0.3680141866207123
21,1,1,5,"Mi mejor compra tecnológica del año. La Laptop Gamer Pro es increíblemente rápida, abre programas en segundos y su pantalla es ideal para mis necesidades de diseño gráfico y gaming. El teclado es muy sensible y el trackpad es preciso. El diseño minimalista es un plus.",2024-06-09,compra tecnológico año laptop gamer pro increíblemente rápido abrir programa segundo pantalla ideal necesidad diseño gráfico gaming teclado sensible trackpad preciso diseño minimalista plus,5 stars,0.6219419240951538
22,2,3,4,"El sonido de estos auriculares es nítido y los bajos se sienten potentes. El diseño es ergonómico y me gusta que no se caen al correr. La batería dura mucho, por lo que no me preocupo por cargarlos a diario. La conectividad es muy estable.",2024-06-10,sonido auricular nítido bajo sentir potente diseño ergonómico gustar caer correr batería duro preocaber cargar él diario conectividad estable,3 stars,0.40022289752960205
23,3,5,2,"La suela de las zapatillas se desgastó en menos de un mes. No son de la calidad que prometen y no vale la pena el precio. Se sienten muy endebles y el soporte es casi nulo. Me arrepiento de la compra, no las recomiendo para un uso regular.",2024-06-11,suela zapatilla desgastar mes calidad prometer valer pena precio sentir endeble soporte nulo arrepientir compra recomeir regular,1 star,0.4426061809062958
24,4,7,5,"Las ollas llegaron en perfecto estado. El tamaño es ideal para mi familia y son muy fáciles de limpiar. El diseño es hermoso y le da un toque moderno a mi cocina. La distribución del calor es fantástica, cocino de manera más uniforme ahora.",2024-06-12,olla llegar perfecto tamaño ideal familia fácil limpiar diseño hermoso toque moderno cocina distribución calor fantástico cocino uniforme,5 stars,0.8075056076049805
25,5,9,3,"Es una mochila regular, esperaba algo más por el precio. No tiene muchos bolsillos internos y no se siente tan resistente como otras que he tenido. Es útil, pero no para un uso intensivo. El material es demasiado delgado para mi gusto.",2024-06-13,mochila regular esperar precio bolsillo interno sentir resistente útil intensivo material delgado gusto,3 stars,0.47204023599624634
26,6,2,4,"El Smartphone Nexus es bueno en general. Sin embargo, la batería se agota rápidamente con un uso intensivo, especialmente al usar aplicaciones de streaming o juegos. La carga rápida ayuda, pero me gustaría más autonomía. La pantalla y el rendimiento son de primera.",2024-06-14,smartphonir nexus general batería agotar rápidamente intensivo especialmente aplicación streaming juego carga rápido ayuda gustar autonomía pantalla rendimiento,4 stars,0.4403479993343353
27,7,4,5,"La camiseta es increíblemente ligera y fresca. Perfecta para el calor del verano. El material absorbe el sudor de maravilla y no se pega al cuerpo. Me encanta el color vibrante, y no se deslava con las lavadas. Es mi camiseta favorita para el gimnasio.",2024-06-15,camiseta increíblemente ligero fresco perfecto calor verano material absorber sudor maravilla pegar cuerpo encantar color vibrante deslair lavada camiseta favorito gimnasio,5 stars,0.8191720843315125
28,8,6,3,"'El Círculo Mágico' me decepcionó. La trama es confusa y los diálogos a veces se sienten poco naturales. Me costó mucho terminar el libro y no me sentí conectado con los personajes. No cumplió con mis expectativas, esperaba una narrativa más fluida.",2024-06-16,círculo mágico decepcionar trama confuso diálogo sentir natural costar terminar libro sentir conectado personaje cumplir expectativa esperar narrativa fluido,1 star,0.49031585454940796
29,9,8,5,"El balón de fútbol tiene un gran control y una superficie que facilita el toque. Es el mejor que he tenido para entrenar. La durabilidad es top, ha aguantado muchos partidos en césped sintético sin perder su forma. El agarre es fantástico.",2024-06-17,balón fútbol control superficie facilitar toque entrenar durabilidad top aguantar partido césped sintético perder forma agarre fantástico,5 stars,0.5748592019081116
30,10,1,5,"La Laptop Gamer Pro superó todas mis expectativas. Es una máquina muy potente que maneja cualquier tarea sin esfuerzo. El sistema de ventilación es silencioso y eficiente, lo que es crucial para largas sesiones de juego. El teclado es muy sensible y el trackpad es preciso.",2024-06-18,laptop gamer pro superar expectativa máquina potente manejar tarea esfuerzo sistema ventilación silencioso eficiente crucial larga sesión juego teclado sensible trackpad preciso,4 stars,0.4499310553073883
31,11,3,4,"El sonido de los auriculares es de alta fidelidad, con bajos profundos y agudos claros. Son un poco pesados, pero el audio compensa. La cancelación de ruido es decente, pero podría ser mejor en entornos muy ruidosos. La conexión Bluetooth es muy estable.",2024-06-19,sonido auricular alto fidelidad bajo profundo agudo claro pesado audio compensar cancelación ruido decente entorno ruidoso conexión bluetooth estable,2 stars,0.4148634672164917
32,12,5,3,Las zapatillas me quedaron grandes a pesar de pedir mi talla habitual. La calidad de los materiales no es tan premium como el precio sugeriría. No las recomiendo si buscas un calzado duradero o con mucho soporte. La suela se siente muy delgada.,2024-06-20,zapatilla quedar pedir talla habitual calidad material premium precio sugeriría recomeir buscar calzado duradero soporte suela sentir delgado,3 stars,0.4029504656791687
33,13,7,5,Este set de ollas es de muy alta calidad. Son robustas y la conducción de calor es excelente. Definitivamente una compra que vale la pena. Las tapas de vidrio son muy útiles para ver la comida mientras se cocina sin tener que levantar la tapa.,2024-06-21,set olla alto calidad robusto conducción calor excelente definitivamente compra valer pena tapa vidrio útil comida cocinar levantar tapa,5 stars,0.7002142667770386
34,14,9,4,La mochila es muy útil para la universidad. El compartimento para la laptop está muy bien acolchado y el diseño es simple y funcional. Me gusta que sea repelente al agua. El puerto de carga USB es un gran detalle que uso a diario.,2024-06-22,mochila útil universidad compartimento laptop acolchado diseño simple funcional gustar repelente agua puerto carga usb detalle diario,4 stars,0.4634905457496643
35,15,2,5,"El Smartphone Nexus es muy rápido y la pantalla se ve increíble. El software es fluido y no tiene bloatware. La cámara de 108MP es simplemente fantástica. La interfaz de usuario es intuitiva y fácil de usar, lo que hace la experiencia muy agradable.",2024-06-23,smartphonir nexus rápido pantalla ver increíble software fluido bloatware cámara simplemente fantástico interfaz usuario intuitivo fácil experiencia agradable,5 stars,0.704276442527771
36,16,4,4,"Un poco ajustada, pero el material es de gran calidad. Es suave al tacto y se siente duradera. Me gusta el color vibrante, es perfecto para mis sesiones de running. El tejido es transpirable y evita el sudor.",2024-06-24,ajustado material calidad suave tacto sentir duradero gustar color vibrante perfecto sesión running tejido transpirable evitar sudor,5 stars,0.5025807023048401
37,17,6,5,Una de las mejores novelas que he leído. La trama es adictiva y los giros inesperados me mantuvieron al borde del asiento. Totalmente recomendable para cualquier fan de la fantasía. La construcción del mundo es excepcional y los personajes son memorables.,2024-06-25,mejor novela leer trama adictivo giro inesperado mantener borde asiento totalmente recomendable fan fantasía construcción mundo excepcional personaje memorable,5 stars,0.8132573962211609
38,18,8,4,"Buen balón, la costura es resistente y el rebote es consistente. El color se desvaneció un poco con el sol, pero eso es un detalle menor. Cumple su función perfectamente, es ideal para un uso regular. El agarre es muy bueno.",2024-06-26,balón costura resistente rebote consistente color desvaneceír sol detalle menor cumplir función perfectamente ideal regular agarre,4 stars,0.4906802773475647
39,19,10,3,"La cámara es buena para videos, pero la conexión con el móvil es muy inestable. Se desconecta constantemente, lo que arruina la experiencia de usuario. La calidad de imagen es decente, pero la usabilidad es mala. El soporte técnico tampoco fue de ayuda.",2024-06-27,cámara video conexión móvil inestable desconectar constantemente arruinar experiencia usuario calidad imagen decente usabilidad malo soporte técnico ayuda,2 stars,0.47458410263061523
40,20,1,5,"Impecable, no he tenido ningún problema con la laptop. El teclado es cómodo para escribir y los altavoces suenan muy bien. Un producto bien construido en todos los aspectos. La pantalla tiene una excelente reproducción de color, ideal para mi trabajo.",2024-06-28,impecable problema laptop teclado cómodo escribir altavoz sonar producto construido aspecto pantalla excelente reproducción color ideal trabajo,5 stars,0.3950254023075104
41,1,3,5,"Simplemente geniales, el sonido es perfecto para mí. Los bajos son profundos y los agudos cristalinos. Los uso para todo, desde música hasta videollamadas. La batería dura mucho, puedo usarlos por varios días sin preocuparme por la carga. La comodidad es excelente.",2024-06-29,simplemente genial sonido perfecto bajo profundo agudo cristalino música videollamada batería duro usar él preocupar yo carga comodidad excelente,5 stars,0.8779371976852417
42,2,5,4,"Me gustaron, son cómodas para caminar largos tramos. El diseño es elegante y combinan con todo. La suela ofrece un buen agarre en diferentes superficies. Son ligeras y se sienten bien en los pies.",2024-06-30,gustar cómodas caminar largo tramo diseño elegante combinar suela ofrecer agarre superficie ligero sentir pie,4 stars,0.5116743445396423
43,3,7,4,"Las ollas son buenas, pero la tapa se calienta demasiado y es necesario usar guantes para manipularlas. Deberían haber diseñado las asas de una forma que no conduzcan tanto el calor. Por lo demás, la calidad de cocción es excelente.",2024-07-01,olla tapa calentar necesario guant manipular él deber diseñar asa forma conducir calor calidad cocción excelente,5 stars,0.4938841164112091
44,4,9,5,"Muy resistente, la mochila es perfecta para viajar. La he usado en la lluvia y el material repelente al agua funcionó de maravilla. El espacio interno es muy amplio y me permite llevar todo lo que necesito. Las correas son muy cómodas.",2024-07-02,resistente mochila perfecto viajar usar lluvia material repelente agua funcionar maravilla espacio interno amplio permitir necesitar correa cómodo,5 stars,0.6830182075500488
45,5,1,5,"La laptop es una bestia, rinde muy bien con juegos pesados y con software de edición de video. No he tenido ningún problema de sobrecalentamiento gracias al sistema de enfriamiento. La pantalla de alta tasa de refresco hace una gran diferencia en la fluidez.",2024-07-03,laptop bestia rendir juego pesado software edición video problema sobrecalentamiento gracias sistema enfriamiento pantalla alto tasa refresco diferencia fluidez,2 stars,0.3352809250354767
46,6,3,4,"Buen sonido, pero el micrófono no es tan claro en las llamadas. Las personas me dicen que mi voz suena un poco apagada. Aún así, para escuchar música son excelentes. La batería dura mucho y la conexión Bluetooth es muy estable.",2024-07-04,sonido micrófono llamada persona voz sonar apagado escuchar música excelente batería duro conexión bluetooth estable,5 stars,0.4796740412712097
47,7,5,3,"Las zapatillas no son muy bonitas y la calidad del material no se siente premium. Son funcionales para el gimnasio, pero no para un uso casual. La suela es muy fina y no ofrece mucho soporte. No las volvería a comprar.",2024-07-05,zapatilla bonito calidad material sentir premium funcional gimnasio casual suela fino ofrecer soporte volver comprar,4 stars,0.41211992502212524
48,8,7,5,"Gran calidad y diseño, las ollas se ven muy elegantes. El acabado es impecable y la distribución del calor es perfecta. Es un set que durará por muchos años. Estoy muy contenta con la compra y las recomiendo a todos.",2024-07-06,calidad diseño olla ver elegante acabado impecable distribución calor perfecto set durar año contentar compra recomeir,5 stars,0.6530594229698181
49,9,1,4,"La batería dura poco, pero por el precio está bien. La laptop es muy potente y cumple con todas mis necesidades, pero debo llevar el cargador a todos lados. Es muy ligera y el rendimiento es increíble.",2024-07-07,batería duro precio laptop potente cumplir necesidad deber cargador lado ligero rendimiento increíble,5 stars,0.6612579822540283
50,10,2,5,"El mejor teléfono que he tenido, la pantalla es una maravilla. Los colores son vibrantes y los negros son profundos. La cámara es increíble, saca fotos muy nítidas. La interfaz de usuario es intuitiva y el rendimiento es muy rápido.",2024-07-08,teléfono pantalla maravilla color vibrante negro profundo cámara increíble sacar foto nítida interfaz usuario intuitivo rendimiento rápido,5 stars,0.8473343849182129
51,11,4,3,"Se encogió un poco después de la primera lavada, a pesar de seguir las instrucciones. Ya no me queda bien, lo cual es una lástima. El material es suave, pero la calidad del tejido no es la mejor. Esperaba más por el precio.",2024-07-09,encoger lavada seguir instrucción quedar lástima material suave calidad tejido esperar precio,3 stars,0.3166680932044983
52,12,6,4,"Me gustó la historia, pero el ritmo es un poco lento. La trama avanza muy lentamente y me costó mantener el interés. El final, sin embargo, es gratificante y los personajes son entrañables. Es una lectura entretenida.",2024-07-10,gustar historia ritmo lento trama avanza lentamente costar mantener interés gratificante personaje entrañabl lectura entretenida,3 stars,0.5092216730117798
