id_comentario,id_cliente,id_producto,calificacion,texto_comentario,fecha_comentario,texto_preprocesado,sentimiento,score
421,21,1,5,"La Laptop Gamer Pro es una máquina excepcional para mi trabajo de diseño gráfico y animación. El procesador i9 y la tarjeta gráfica RTX 4080 manejan todo con una fluidez asombrosa. La pantalla de alta resolución y los colores vibrantes son perfectos para la edición. Sin duda, un equipo de alto rendimiento.",2025-07-14,laptop gamer pro máquina excepcional trabajo diseño gráfico animación procesador tarjeta gráfico rtx manejar fluidez asombroso pantalla alto resolución color vibrante perfecto edición duda equipo alto rendimiento,5 stars,0.6585713028907776
422,22,10,5,La Cámara de Acción 4K es perfecta para mis viajes de aventura. La calidad de video es impresionante y la estabilización de imagen es de otro nivel. He grabado en bicicleta de montaña y los videos son increíblemente fluidos. La batería dura mucho tiempo y es muy resistente a los golpes.,2025-07-15,cámara acción perfecto viaje aventura calidad video impresionante estabilización imagen nivel grabar bicicleta montaña video increíblemente fluido batería duro tiempo resistente golpe,5 stars,0.7372655868530273
423,23,1,5,"La Laptop Gamer Pro es una bestia de rendimiento. Los juegos corren a la máxima configuración sin ningún problema. El teclado es muy cómodo y el sistema de enfriamiento es muy eficiente, nunca se sobrecalienta. La pantalla de 144Hz hace una gran diferencia en la fluidez de los juegos.",2025-07-16,laptop gamer pro bestia rendimiento juego correr máximo configuración problema teclado cómodo sistema enfriamiento eficiente sobrecalientar pantalla diferencia fluidez juegos,4 stars,0.32665202021598816
424,24,10,4,"La Cámara de Acción 4K graba videos con una calidad excelente, pero la aplicación móvil es un poco lenta para transferir los archivos. Aún así, la cámara en sí es muy robusta y la batería es duradera. Me gusta mucho su carcasa impermeable.",2025-07-17,cámara acción grar video calidad excelente aplicación móvil lento transferir archivo cámara robusta batería duradero gustar carcasa impermeable,5 stars,0.5454959869384766
425,25,1,5,"Mi nueva laptop es una joya. El rendimiento es impecable tanto para el trabajo como para el entretenimiento. La pantalla OLED es espectacular, los colores son muy vivos y los negros son profundos. El diseño es muy elegante y ligero.",2025-07-18,laptop joya rendimiento impecable trabajo entretenimiento pantalla oled espectacular color vivo negro profundo diseño elegante ligero,5 stars,0.6708387732505798
426,1,10,5,"Esta cámara es una maravilla. La calidad de las fotos y videos es impresionante, especialmente en 4K. La estabilización de imagen es perfecta para tomas en movimiento. Es muy fácil de usar y la pantalla táctil es muy intuitiva.",2025-07-19,cámara maravilla calidad foto video impresionante especialmente estabilización imagen perfecto toma movimiento fácil pantalla táctil intuitivo,5 stars,0.8656908869743347
427,2,1,4,"La Laptop Gamer Pro es potente, pero la batería se agota muy rápido cuando juego. Para tareas básicas dura más, pero para gaming tengo que mantenerla conectada. A pesar de eso, el rendimiento es increíble.",2025-07-20,laptop gamer pro potente batería agotar rápido juego tarea básico duro gaming mantener él conectado rendimiento increíble,5 stars,0.6048662662506104
428,3,10,3,"La cámara es buena, pero el micrófono integrado es de baja calidad. El audio se escucha muy bajo y con mucho ruido de fondo. Tuve que comprar un micrófono externo. La calidad de video es buena, pero el audio es un problema.",2025-07-21,cámara micrófono integrado bajo calidad audio escuchar ruido fondo tener comprar micrófono externo calidad video audio problema,2 stars,0.44017818570137024
429,4,1,5,"Impecable. La laptop es increíblemente rápida y fluida. La uso para todo, desde edición de video hasta programación. La pantalla es muy nítida y el teclado es muy cómodo para escribir. No he tenido ningún problema de rendimiento.",2025-07-22,impecable laptop increíblemente rápido fluido edición video programación pantalla nítido teclado cómodo escribir problema rendimiento,5 stars,0.5630209445953369
430,5,10,5,La Cámara de Acción 4K es muy resistente y graba con una calidad asombrosa. Es perfecta para mis deportes extremos. La estabilización es tan buena que mis videos se ven profesionales. La batería dura mucho y es fácil de cargar.,2025-07-23,cámara acción resistente grar calidad asombroso perfecto deporte extremo estabilización video ver profesional batería duro fácil cargar,5 stars,0.6662725806236267
431,6,1,4,"El rendimiento de la laptop es genial, pero el ventilador hace mucho ruido cuando está en su máximo rendimiento. Aparte de eso, la potencia es increíble. La pantalla es de alta calidad y el teclado es muy suave.",2025-07-24,rendimiento laptop genial ventilador ruido máximo rendimiento aparte potencia increíble pantalla alto calidad teclado suave,5 stars,0.7655351161956787
432,7,10,4,"Buena cámara, pero se calienta un poco al grabar por un tiempo prolongado. La calidad de video es excelente, pero el sobrecalentamiento es una preocupación. La batería es duradera, pero la cámara se calienta mucho.",2025-07-25,cámara calentar grabar tiempo prolongado calidad video excelente sobrecalentamiento preocupación batería duradero cámara calentar,4 stars,0.3848046064376831
433,8,1,5,La Laptop Gamer Pro es una de las mejores inversiones que he hecho. El procesador es muy rápido y la tarjeta gráfica es muy potente. Rinde perfecto con cualquier programa que use. El diseño es elegante y el peso es ideal para llevarla a la oficina.,2025-07-26,laptop gamer pro mejor inversión procesador rápido tarjeta gráfico potente rendir perfecto programa usar diseño elegante peso ideal llevar él oficina,5 stars,0.7482640743255615
434,9,10,5,"La cámara es muy fácil de usar y la calidad de video es de primera. La he usado en la playa y bajo el agua, y ha funcionado de maravilla. La estabilización es muy buena y la batería dura mucho tiempo.",2025-07-27,cámara fácil calidad video usar playa agua funcionar maravilla estabilización batería duro tiempo,5 stars,0.620870053768158
435,10,1,5,"Esta laptop es la definición de potencia y portabilidad. El procesador es rapidísimo, la pantalla es brillante y el teclado es muy cómodo. Rinde de manera excepcional en todo lo que hago. Una excelente compra.",2025-07-28,laptop definición potencia portabilidad procesador rapidísimo pantalla brillante teclado cómodo rendir excepcional excelente compra,5 stars,0.8204385638237
436,11,10,3,"La cámara es buena, pero la conexión con mi teléfono es muy inestable. Se desconecta constantemente, lo que hace difícil transferir videos. La calidad de imagen es buena, pero la conectividad es deficiente.",2025-07-29,cámara conexión teléfono inestable desconectar constantemente difícil transferir video calidad imagen conectividad deficiente,1 star,0.49268150329589844
437,12,1,5,"La Laptop Gamer Pro es un monstruo de rendimiento. La pantalla es increíble para ver películas y la tarjeta gráfica es tan potente que puedo jugar a cualquier juego en alta resolución. La batería dura poco, pero el rendimiento lo compensa.",2025-07-30,laptop gamer pro monstruo rendimiento pantalla increíble película tarjeta gráfico potente jugar juego alto resolución batería duro rendimiento compensar,5 stars,0.5631219744682312
438,13,10,5,"La calidad de video de esta cámara es asombrosa, incluso en baja luz. La estabilización es perfecta para mis videos de caminatas. La carcasa protectora es muy resistente. Es el mejor equipo que he tenido para mis aventuras.",2025-07-31,calidad video cámara asombroso bajo luz estabilización perfecto video caminata carcasa protectora resistente equipo aventura,5 stars,0.6374636292457581
439,14,1,4,"La laptop es muy rápida, pero la pantalla tiene un poco de fuga de luz en las esquinas. Es un detalle menor, pero es algo que esperaba no encontrar en un producto premium. El rendimiento es fantástico.",2025-08-01,laptop rápido pantalla fuga luz esquina detalle menor esperar encontrar producto premium rendimiento fantástico,4 stars,0.4530956447124481
440,15,10,4,"Buena cámara, pero el control de la aplicación para el móvil es un poco complicado de usar. Los videos en 4K se ven muy bien, pero la usabilidad podría ser mejor. La batería es duradera.","2025-08-02""",cámara control aplicación móvil complicado video ver usabilidad batería duradero,3 stars,0.41260451078414917
441,16,1,5,"Excelente laptop, el teclado es muy cómodo. El rendimiento es impecable, no se calienta en absoluto. La pantalla tiene colores muy precisos, ideal para mi trabajo. Estoy muy contento con la compra.",2025-08-03,excelente laptop teclado cómodo rendimiento impecable calentar absoluto pantalla color preciso ideal trabajo contento compra,5 stars,0.7600710988044739
442,17,10,5,La Cámara de Acción 4K es una joya. La calidad de las fotos es de otro nivel. La he usado en la nieve y en la lluvia y ha aguantado perfectamente. La batería dura mucho y es muy fácil de usar.,"2025-08-04""",cámara acción joya calidad foto nivel usar nieve lluvia aguantar perfectamente batería duro fácil,5 stars,0.6341990828514099
443,18,1,5,"La laptop es un sueño. El rendimiento es bestial, los juegos corren fluidos. La pantalla es vibrante y el teclado es muy responsivo. No hay nada de lo que quejarme.",2025-08-05,laptop sueño rendimiento bestial juego correr fluido pantalla vibrante teclado responsivo quejarme,1 star,0.29695576429367065
444,19,10,3,"La cámara es buena, pero a veces los videos se congelan. La calidad de video es buena, pero el software parece tener problemas. La batería dura poco cuando la uso para grabar en 4K.",2025-08-06,cámara video congelar calidad video software problema batería duro grabar,2 stars,0.36065107583999634
445,20,1,5,El mejor equipo que he tenido. La laptop es muy rápida y el diseño es muy elegante. El teclado es muy cómodo para escribir y los altavoces suenan genial. Una excelente compra.,2025-08-07,equipo laptop rápido diseño elegante teclado cómodo escribir altavoz sonar genial excelente compra,5 stars,0.772067666053772
446,21,10,4,"Buena cámara, pero el cable de carga es muy corto. La calidad de video es muy buena y la estabilización es perfecta, pero el cable es un problema.",2025-08-08,cámara cable carga corto calidad video estabilización perfecto cable problema,3 stars,0.2779408097267151
447,22,1,5,Esta laptop es perfecta para mis necesidades. El rendimiento es increíble para el trabajo y los juegos. La pantalla de alta resolución y el teclado retroiluminado son un gran plus. La batería dura decentemente.,2025-08-09,laptop perfecto necesidad rendimiento increíble trabajo juegos pantalla alto resolución teclado retroiluminado plus batería duro decentemente,5 stars,0.7785733938217163
448,23,10,5,"La cámara es muy fácil de usar, la he usado para grabar mis vacaciones y los videos son increíbles. La estabilización de imagen es fantástica, incluso en movimiento. La batería dura mucho tiempo.",2025-08-10,cámara fácil usar grabar vacación video increíble estabilización imagen fantástico movimiento batería duro tiempo,5 stars,0.6879247426986694
449,24,1,5,La Laptop Gamer Pro es una bestia. El procesador es muy rápido y la tarjeta gráfica es muy potente. No he tenido problemas con ningún juego. Es un producto premium que vale la pena.,2025-08-11,laptop gamer pro bestia procesador rápido tarjeta gráfico potente problema juego producto premium valer pena,3 stars,0.30371561646461487
450,25,10,4,"La cámara graba muy bien, pero el soporte para la bicicleta no es muy resistente. Se mueve un poco. La calidad de video es excelente.",2025-08-12,cámara grar soporte bicicleta resistente mover calidad video excelente,5 stars,0.632409930229187
451,1,1,5,"Impresionante, la mejor laptop que he comprado. El rendimiento es increíble, ideal para mis proyectos de diseño. La pantalla tiene una resolución fantástica y los colores son muy precisos.",2025-08-13,impresionante laptop comprar rendimiento increíble ideal proyecto diseño pantalla resolución fantástico color preciso,5 stars,0.8988588452339172
452,2,10,3,"La cámara es buena, pero la batería no dura tanto como prometen. Me decepcionó un poco, ya que necesito grabar por periodos largos. La calidad de video es buena, pero la batería es un gran problema.",2025-08-14,cámara batería durar prometer decepcionar necesitar grabar periodo largo calidad video batería problema,2 stars,0.4547177255153656
453,3,1,5,La Laptop Gamer Pro es una máquina increíblemente potente. El teclado es muy responsivo y la pantalla es de alta resolución. No se calienta ni siquiera después de horas de juego. Una excelente inversión.,2025-08-15,laptop gamer pro máquina increíblemente potente teclado responsivo pantalla alto resolución calentar siquiera hora juego excelente inversión,5 stars,0.7562187910079956
454,4,10,5,Esta cámara es fantástica para grabar videos de deportes extremos. La calidad de video es impresionante y la carcasa es muy resistente. La estabilización de imagen es de otro nivel. La batería dura mucho.,2025-08-16,cámara fantástico grabar video deporte extremo calidad video impresionante carcasa resistente estabilización imagen nivel batería duro,5 stars,0.7306925654411316
455,5,1,4,"La laptop es muy rápida y el diseño es elegante. Sin embargo, la batería dura poco, lo cual es una lástima. El rendimiento es increíble, pero la portabilidad es un problema.",2025-08-17,laptop rápido diseño elegante batería duro lástima rendimiento increíble portabilidad problema,4 stars,0.29581448435783386
456,6,10,5,La Cámara de Acción 4K es una maravilla. La calidad de video es asombrosa y la estabilización es perfecta para tomas en movimiento. Es muy fácil de usar y la pantalla táctil es muy intuitiva. La batería es duradera.,2025-08-18,cámara acción maravilla calidad video asombroso estabilización perfecto toma movimiento fácil pantalla táctil intuitivo batería duradero,5 stars,0.8561250567436218
457,7,1,5,La laptop es una bestia. El procesador es muy rápido y la tarjeta gráfica es muy potente. Rinde perfecto en todo lo que hago. El sistema de enfriamiento es muy eficiente y silencioso.,2025-08-19,laptop bestia procesador rápido tarjeta gráfico potente rendir perfecto sistema enfriamiento eficiente silencioso,5 stars,0.6872261166572571
458,8,10,3,"El micrófono de la cámara es de baja calidad. El audio se escucha con mucho ruido de fondo. La calidad de video es buena, pero el audio es un problema.",2025-08-20,micrófono cámara bajo calidad audio escuchar ruido fondo calidad video audio problema,2 stars,0.4666938781738281
459,9,1,5,"El mejor equipo que he tenido. El rendimiento es impecable, y el diseño es elegante y ligero. La pantalla es vibrante y el teclado es muy cómodo.",2025-08-21,equipo rendimiento impecable diseño elegante ligero pantalla vibrante teclado cómodo,5 stars,0.6324282288551331
460,10,10,5,"Esta cámara es perfecta. La calidad de video es de primera, la estabilización es genial y la batería dura mucho. Es muy fácil de usar y la carcasa es muy resistente.",2025-08-22,cámara perfecto calidad video estabilización genial batería duro fácil carcasa resistente,5 stars,0.7701874375343323
461,11,1,5,La laptop es una maravilla. El procesador es muy rápido y el rendimiento es excepcional. La pantalla de alta resolución es ideal para mi trabajo y los juegos. El teclado es muy cómodo.,2025-08-23,laptop maravilla procesador rápido rendimiento excepcional pantalla alto resolución ideal trabajo juegos teclado cómodo,5 stars,0.8774167895317078
462,12,10,4,"Buena cámara, pero a veces los videos se ven un poco borrosos. La calidad de video es excelente en general, pero a veces no enfoca bien. La batería es duradera.",2025-08-24,cámara video ver borroso calidad video excelente general enfocar batería duradero,5 stars,0.5258409380912781
463,13,1,4,"La laptop es muy potente, pero la pantalla tiene un poco de fuga de luz. Es un detalle menor, pero en un producto premium se nota. El rendimiento es fantástico.",2025-08-25,laptop potente pantalla fuga luz detalle menor producto premium notar rendimiento fantástico,4 stars,0.4816989600658417
464,14,10,5,La calidad de video de esta cámara es asombrosa. La estabilización es perfecta para mis videos de caminatas. La carcasa protectora es muy resistente. Es el mejor equipo que he tenido para mis aventuras.,2025-08-26,calidad video cámara asombroso estabilización perfecto video caminata carcasa protectora resistente equipo aventura,5 stars,0.6960119009017944
465,15,1,5,El rendimiento de esta laptop es sobresaliente. Es capaz de manejar cualquier software de diseño y renderizado sin problemas. La pantalla de alta tasa de refresco hace una gran diferencia en la fluidez. El sistema de enfriamiento es eficiente.,2025-08-27,rendimiento laptop sobresaliente capaz manejar software diseño renderizado problema pantalla alto tasa refresco diferencia fluidez sistema enfriamiento eficiente,4 stars,0.48314106464385986
466,16,10,4,"Buena cámara, pero el control de la aplicación para el móvil es un poco complicado de usar. Los videos en 4K se ven muy bien, pero la usabilidad podría ser mejor.",2025-08-28,cámara control aplicación móvil complicado video ver usabilidad,3 stars,0.36708864569664
467,17,1,5,"Excelente laptop, el teclado es muy cómodo. El rendimiento es impecable, no se calienta. La pantalla tiene colores precisos, ideal para mi trabajo.",2025-08-29,excelente laptop teclado cómodo rendimiento impecable calentar pantalla color preciso ideal trabajo,5 stars,0.7116734981536865
468,18,10,5,La Cámara de Acción 4K es una joya. La calidad de las fotos es de otro nivel. La he usado en la nieve y en la lluvia y ha aguantado perfectamente. La batería dura mucho y es fácil de usar.,2025-08-30,cámara acción joya calidad foto nivel usar nieve lluvia aguantar perfectamente batería duro fácil,5 stars,0.6341990828514099
469,19,1,5,La laptop es un sueño. El rendimiento es bestial. La pantalla es vibrante y el teclado es muy responsivo. No tengo ninguna queja.,2025-08-31,laptop sueño rendimiento bestial pantalla vibrante teclado responsivo queja,1 star,0.3079540431499481
470,20,10,3,"La cámara es buena, pero a veces los videos se congelan. La calidad de video es buena, pero el software parece tener problemas. La batería dura poco cuando la uso para grabar en 4K.",2025-09-01,cámara video congelar calidad video software problema batería duro grabar,2 stars,0.36065107583999634
471,21,1,5,El mejor equipo que he tenido. La laptop es muy rápida y el diseño es muy elegante. El teclado es muy cómodo para escribir.,2025-09-02,equipo laptop rápido diseño elegante teclado cómodo escribir,5 stars,0.5596944689750671
472,22,10,4,"Buena cámara, pero el cable de carga es muy corto. La calidad de video es muy buena y la estabilización es perfecta.",2025-09-03,cámara cable carga corto calidad video estabilización perfecto,5 stars,0.5161577463150024
473,23,1,5,Esta laptop es perfecta para mis necesidades. El rendimiento es increíble para el trabajo y los juegos. La pantalla de alta resolución y el teclado retroiluminado son un gran plus.,2025-09-04,laptop perfecto necesidad rendimiento increíble trabajo juegos pantalla alto resolución teclado retroiluminado plus,5 stars,0.8120086193084717
474,24,10,5,"La cámara es muy fácil de usar, la he usado para grabar mis vacaciones y los videos son increíbles. La estabilización de imagen es fantástica. La batería dura mucho tiempo.",2025-09-05,cámara fácil usar grabar vacación video increíble estabilización imagen fantástico batería duro tiempo,5 stars,0.7391226887702942
475,25,1,5,La Laptop Gamer Pro es una bestia. El procesador es muy rápido y la tarjeta gráfica es muy potente. No he tenido problemas con ningún juego.,2025-09-06,laptop gamer pro bestia procesador rápido tarjeta gráfico potente problema juego,3 stars,0.296438992023468
476,1,10,4,"La cámara graba muy bien, pero el soporte para la bicicleta no es muy resistente. Se mueve un poco. La calidad de video es excelente.",2025-09-07,cámara grar soporte bicicleta resistente mover calidad video excelente,5 stars,0.632409930229187
477,2,1,5,"Impresionante, la mejor laptop. El rendimiento es increíble, ideal para mis proyectos. La pantalla tiene una resolución fantástica y los colores son muy precisos.",2025-09-08,impresionante laptop rendimiento increíble ideal proyecto pantalla resolución fantástico color preciso,5 stars,0.9036273956298828
478,3,10,3,"La cámara es buena, pero la batería no dura tanto como prometen. Me decepcionó. La calidad de video es buena, pero la batería es un gran problema.",2025-09-09,cámara batería durar prometer decepcionar calidad video batería problema,1 star,0.44030892848968506
479,4,1,5,La Laptop Gamer Pro es una máquina increíblemente potente. El teclado es muy responsivo y la pantalla es de alta resolución. No se calienta. Una excelente inversión.,2025-09-10,laptop gamer pro máquina increíblemente potente teclado responsivo pantalla alto resolución calentar excelente inversión,5 stars,0.8112541437149048
480,5,10,5,Esta cámara es fantástica para grabar deportes extremos. La calidad de video es impresionante y la carcasa es muy resistente. La estabilización de imagen es de otro nivel.,2025-09-11,cámara fantástico grabar deporte extremo calidad video impresionante carcasa resistente estabilización imagen nivel,5 stars,0.7515953183174133
481,6,1,4,"La laptop es muy rápida y el diseño es elegante. Sin embargo, la batería dura poco, lo cual es una lástima. El rendimiento es increíble.",2025-09-12,laptop rápido diseño elegante batería duro lástima rendimiento increíble,5 stars,0.7516709566116333
482,7,10,5,La Cámara de Acción 4K es una maravilla. La calidad de video es asombrosa y la estabilización es perfecta. Es muy fácil de usar y la pantalla táctil es intuitiva.,2025-09-13,cámara acción maravilla calidad video asombroso estabilización perfecto fácil pantalla táctil intuitivo,5 stars,0.8557982444763184
483,8,1,5,La laptop es una bestia. El procesador es muy rápido y la tarjeta gráfica es muy potente. Rinde perfecto en todo lo que hago. El sistema de enfriamiento es muy eficiente y silencioso.,2025-09-14,laptop bestia procesador rápido tarjeta gráfico potente rendir perfecto sistema enfriamiento eficiente silencioso,5 stars,0.6872261166572571
484,9,10,3,"El micrófono de la cámara es de baja calidad. El audio se escucha con ruido de fondo. La calidad de video es buena, pero el audio es un problema.",2025-09-15,micrófono cámara bajo calidad audio escuchar ruido fondo calidad video audio problema,2 stars,0.4666938781738281
485,10,1,5,"El mejor equipo que he tenido. El rendimiento es impecable, y el diseño es elegante y ligero. La pantalla es vibrante y el teclado es muy cómodo.",2025-09-16,equipo rendimiento impecable diseño elegante ligero pantalla vibrante teclado cómodo,5 stars,0.6324282288551331
486,11,10,5,"Esta cámara es perfecta. La calidad de video es de primera, la estabilización es genial y la batería dura mucho. Es muy fácil de usar.",2025-09-17,cámara perfecto calidad video estabilización genial batería duro fácil,5 stars,0.7950683832168579
487,12,1,5,La laptop es una maravilla. El procesador es muy rápido y el rendimiento es excepcional. La pantalla de alta resolución es ideal para mi trabajo.,2025-09-18,laptop maravilla procesador rápido rendimiento excepcional pantalla alto resolución ideal trabajo,5 stars,0.897431492805481
488,13,10,4,"Buena cámara, pero a veces los videos se ven un poco borrosos. La calidad de video es excelente en general.",2025-09-19,cámara video ver borroso calidad video excelente general,5 stars,0.49044710397720337
489,14,1,4,"La laptop es potente, pero la pantalla tiene fuga de luz. Es un detalle menor. El rendimiento es fantástico.",2025-09-20,laptop potente pantalla fuga luz detalle menor rendimiento fantástico,4 stars,0.4549223482608795
490,15,10,5,La calidad de video de esta cámara es asombrosa. La estabilización es perfecta para mis videos de caminatas. La carcasa protectora es muy resistente.,2025-09-21,calidad video cámara asombroso estabilización perfecto video caminata carcasa protectora resistente,5 stars,0.7242499589920044
491,16,1,5,El rendimiento de esta laptop es sobresaliente. Es capaz de manejar cualquier software de diseño y renderizado. La pantalla de alta tasa de refresco es genial.,2025-09-22,rendimiento laptop sobresaliente capaz manejar software diseño renderizado pantalla alto tasa refresco genial,5 stars,0.7465282678604126
492,17,10,4,"Buena cámara, pero el control de la aplicación para el móvil es complicado de usar. Los videos en 4K se ven muy bien.",2025-09-23,cámara control aplicación móvil complicado video ver,2 stars,0.3646158277988434
493,18,1,5,"Excelente laptop, el teclado es cómodo. El rendimiento es impecable. La pantalla tiene colores precisos, ideal para mi trabajo.",2025-09-24,excelente laptop teclado cómodo rendimiento impecable pantalla color preciso ideal trabajo,5 stars,0.720866858959198
494,19,10,5,La Cámara de Acción 4K es una joya. La calidad de las fotos es de otro nivel. La he usado en la nieve y en la lluvia. La batería dura mucho.,2025-09-25,cámara acción joya calidad foto nivel usar nieve lluvia batería duro,5 stars,0.462651789188385
495,20,1,5,La laptop es un sueño. El rendimiento es bestial. La pantalla es vibrante y el teclado es responsivo. No tengo ninguna queja.,2025-09-26,laptop sueño rendimiento bestial pantalla vibrante teclado responsivo queja,1 star,0.3079540431499481
